{
  "code_identity": {
    "algorithm": "sha256",
    "components": [
      ".agent/harness/policy/failure-severity-policy.yaml",
      ".agent/harness/policy/harness-policy.yaml",
      ".agent/harness/policy/p0-acceptance-policy.yaml",
      ".agent/harness/policy/provider-call-policy.yaml",
      ".agent/harness/schemas/contract-result.schema.json",
      ".agent/harness/schemas/current-four-manifest.schema.json",
      ".agent/harness/schemas/global-contract-bindings.schema.json",
      ".agent/harness/schemas/human-verdict.schema.json",
      ".agent/harness/schemas/live-run-evidence.schema.json",
      ".agent/harness/schemas/p0-contracts.schema.json",
      ".agent/harness/schemas/provider-fixture.schema.json",
      ".agent/harness/schemas/receipt.schema.json",
      ".agent/harness/schemas/run.schema.json",
      ".agent/harness/schemas/visual-symbol-annotation-verdict.schema.json",
      ".agent/harness/schemas/visual-symbol-eval.schema.json",
      ".agent/harness/scripts/check-contracts.py",
      ".agent/harness/scripts/generate-contract-mirror.py",
      ".agent/harness/scripts/generate-global-bindings.py",
      ".agent/harness/scripts/generate-receipt.py",
      ".agent/harness/scripts/live_evidence_policy.py",
      ".agent/harness/scripts/record-human-verdict.py",
      ".agent/harness/scripts/run-p0.py",
      ".agent/harness/scripts/run-provider-contracts.py",
      ".agent/harness/scripts/stage-current-four.py",
      ".agent/harness/scripts/stage-symbol-eval.py",
      ".agent/harness/scripts/summarize-run.py",
      ".agent/harness/scripts/symbol_eval.py",
      ".agent/harness/scripts/verify-export-consistency.py",
      ".env.example",
      "Makefile",
      "backend/Dockerfile",
      "backend/alembic.ini",
      "backend/alembic/env.py",
      "backend/alembic/versions/0001_core.py",
      "backend/alembic/versions/0002_processing.py",
      "backend/alembic/versions/0003_candidates.py",
      "backend/alembic/versions/0004_review.py",
      "backend/alembic/versions/0005_balloons.py",
      "backend/alembic/versions/0006_exports.py",
      "backend/alembic/versions/0007_processing_stage.py",
      "backend/app/__init__.py",
      "backend/app/audit/operations.py",
      "backend/app/balloons/__init__.py",
      "backend/app/balloons/models.py",
      "backend/app/balloons/numbering.py",
      "backend/app/balloons/placement.py",
      "backend/app/balloons/renderer.py",
      "backend/app/balloons/router.py",
      "backend/app/balloons/schemas.py",
      "backend/app/balloons/service.py",
      "backend/app/balloons/validator.py",
      "backend/app/candidates/advisor.py",
      "backend/app/candidates/complex_fallback.py",
      "backend/app/candidates/coverage.py",
      "backend/app/candidates/disposition.py",
      "backend/app/candidates/duplicates.py",
      "backend/app/candidates/grouping.py",
      "backend/app/candidates/models.py",
      "backend/app/candidates/parser.py",
      "backend/app/candidates/schemas.py",
      "backend/app/candidates/symbol_review.py",
      "backend/app/capabilities/service.py",
      "backend/app/celery_app.py",
      "backend/app/config.py",
      "backend/app/db.py",
      "backend/app/errors/models.py",
      "backend/app/exports/excel.py",
      "backend/app/exports/manifest.py",
      "backend/app/exports/models.py",
      "backend/app/exports/naming.py",
      "backend/app/exports/router.py",
      "backend/app/exports/schemas.py",
      "backend/app/exports/service.py",
      "backend/app/exports/template_registry.py",
      "backend/app/exports/validators.py",
      "backend/app/jobs/idempotency.py",
      "backend/app/main.py",
      "backend/app/pdf/__init__.py",
      "backend/app/pdf/classification.py",
      "backend/app/pdf/coordinates.py",
      "backend/app/pdf/inventory.py",
      "backend/app/pdf/schemas.py",
      "backend/app/pdf/visual_observations.py",
      "backend/app/processing/automatic_result.py",
      "backend/app/processing/pipeline.py",
      "backend/app/processing/runtime_recognition.py",
      "backend/app/processing/tasks.py",
      "backend/app/projects/models.py",
      "backend/app/projects/router.py",
      "backend/app/projects/schemas.py",
      "backend/app/projects/service.py",
      "backend/app/projects/state.py",
      "backend/app/providers/base.py",
      "backend/app/providers/call_records.py",
      "backend/app/providers/candidate_review.schema.json",
      "backend/app/providers/qwen_vl.py",
      "backend/app/providers/runtime.py",
      "backend/app/providers/tencent_ocr.py",
      "backend/app/providers/visual_symbol_review.schema.json",
      "backend/app/review/locks.py",
      "backend/app/review/models.py",
      "backend/app/review/router.py",
      "backend/app/review/schemas.py",
      "backend/app/review/service.py",
      "backend/app/storage/local.py",
      "backend/app/storage/models.py",
      "backend/pyproject.toml",
      "backend/tests/contract/conftest.py",
      "backend/tests/contract/harness/harness_test_support.py",
      "backend/tests/contract/harness/test_contract_architecture.py",
      "backend/tests/contract/harness/test_live_run_contract.py",
      "backend/tests/contract/harness/test_receipt_policy.py",
      "backend/tests/contract/harness/test_symbol_eval_contract.py",
      "backend/tests/contract/test_provider_call_records.py",
      "backend/tests/contract/test_qwen_symbol_provider.py",
      "backend/tests/contract/test_qwen_vl_provider.py",
      "backend/tests/contract/test_review_schema.py",
      "backend/tests/contract/test_tencent_ocr_provider.py",
      "backend/tests/e2e/test_no_silent_success.py",
      "backend/tests/e2e/test_offline_automatic_result.py",
      "backend/tests/e2e/test_offline_vertical.py",
      "backend/tests/e2e/test_symbol_recognition.py",
      "backend/tests/helpers/__init__.py",
      "backend/tests/helpers/symbol_fixture.py",
      "backend/tests/integration/test_balloon_api.py",
      "backend/tests/integration/test_balloon_operations.py",
      "backend/tests/integration/test_balloon_pdf_renderer.py",
      "backend/tests/integration/test_balloon_service.py",
      "backend/tests/integration/test_balloon_validation.py",
      "backend/tests/integration/test_error_records.py",
      "backend/tests/integration/test_excel_export.py",
      "backend/tests/integration/test_export_atomicity.py",
      "backend/tests/integration/test_export_consistency.py",
      "backend/tests/integration/test_export_preflight.py",
      "backend/tests/integration/test_operator_audit.py",
      "backend/tests/integration/test_pdf_inventory.py",
      "backend/tests/integration/test_processing_entry_task.py",
      "backend/tests/integration/test_processing_preflight.py",
      "backend/tests/integration/test_processing_state.py",
      "backend/tests/integration/test_project_intake_api.py",
      "backend/tests/integration/test_project_status_api.py",
      "backend/tests/integration/test_project_workbench_api.py",
      "backend/tests/integration/test_result_layers.py",
      "backend/tests/integration/test_review_freeze.py",
      "backend/tests/integration/test_review_lock.py",
      "backend/tests/integration/test_review_operations.py",
      "backend/tests/integration/test_review_version.py",
      "backend/tests/integration/test_review_working_copy.py",
      "backend/tests/integration/test_runtime_topology.py",
      "backend/tests/integration/test_schema.py",
      "backend/tests/integration/test_storage.py",
      "backend/tests/integration/test_symbol_recognition_pipeline.py",
      "backend/tests/integration/test_task_idempotency.py",
      "backend/tests/unit/balloons/test_collision_layout.py",
      "backend/tests/unit/balloons/test_layout.py",
      "backend/tests/unit/balloons/test_numbering.py",
      "backend/tests/unit/candidates/test_advisor.py",
      "backend/tests/unit/candidates/test_complex_fallback.py",
      "backend/tests/unit/candidates/test_coverage.py",
      "backend/tests/unit/candidates/test_disposition.py",
      "backend/tests/unit/candidates/test_duplicates.py",
      "backend/tests/unit/candidates/test_grouping.py",
      "backend/tests/unit/candidates/test_parser.py",
      "backend/tests/unit/candidates/test_symbol_advisor.py",
      "backend/tests/unit/exports/test_excel_mapping.py",
      "backend/tests/unit/exports/test_excel_safety.py",
      "backend/tests/unit/exports/test_manifest.py",
      "backend/tests/unit/exports/test_naming.py",
      "backend/tests/unit/exports/test_template_registry.py",
      "backend/tests/unit/pdf/test_classification.py",
      "backend/tests/unit/pdf/test_coordinates.py",
      "backend/tests/unit/pdf/test_inventory.py",
      "backend/tests/unit/pdf/test_runtime_ocr.py",
      "backend/tests/unit/pdf/test_visual_observations.py",
      "backend/tests/unit/review/test_locks.py",
      "backend/tests/unit/storage/test_local.py",
      "compose.yaml",
      "environment.yml",
      "frontend/Dockerfile",
      "frontend/e2e/chinese-pdf-upload-mvp.spec.ts",
      "frontend/e2e/p0-workbench.spec.ts",
      "frontend/index.html",
      "frontend/package-lock.json",
      "frontend/package.json",
      "frontend/playwright.config.ts",
      "frontend/src/api/client.ts",
      "frontend/src/api/types.ts",
      "frontend/src/app/QualityInspectionApp.test.tsx",
      "frontend/src/app/QualityInspectionApp.tsx",
      "frontend/src/app/localContext.test.ts",
      "frontend/src/app/localContext.ts",
      "frontend/src/components/balloons/BalloonOverlay.test.tsx",
      "frontend/src/components/balloons/BalloonOverlay.tsx",
      "frontend/src/components/balloons/BalloonToolbar.tsx",
      "frontend/src/components/pdf/OverlayLayer.test.tsx",
      "frontend/src/components/pdf/OverlayLayer.tsx",
      "frontend/src/components/pdf/PdfWorkspace.test.tsx",
      "frontend/src/components/pdf/PdfWorkspace.tsx",
      "frontend/src/components/review/ReviewPanel.test.tsx",